PATH;/Temp/MP;;;;;;;
VALUES;USDA01240;Ice cream cone, chocolate covered, with nuts, flavors other than chocolate;Ice cream cone, chocolate covered, with nuts, flavors other than chocolate;Crème cône de glace, enrobées de chocolat, de noix, d'autres saveurs que le chocolat;Ice cream cone, chocolate covered, with nuts, flavors other than chocolate;USDA;Dairy and Egg Products;Table USDA
VALUES;USDA01241;Ice cream sandwich, made with light ice cream, vanilla;Ice cream sandwich, made with light ice cream, vanilla;Sandwich à la crème glacée, faite avec de la crème glacée légère, à la vanille;Ice cream sandwich, made with light ice cream, vanilla;USDA;Dairy and Egg Products;Table USDA
VALUES;USDA01242;Ice cream sandwich, vanilla, light, no sugar added;Ice cream sandwich, vanilla, light, no sugar added;Sandwich à la crème glacée, de la vanille, la lumière, sans sucre ajouté;Ice cream sandwich, vanilla, light, no sugar added;USDA;Dairy and Egg Products;Table USDA
VALUES;USDA01243;Fat free ice cream, no sugar added, flavors other than chocolate;Fat free ice cream, no sugar added, flavors other than chocolate;Fat crème glacée gratuite, sans sucre ajouté, d'autres saveurs que le chocolat;Fat free ice cream, no sugar added, flavors other than chocolate;USDA;Dairy and Egg Products;Table USDA
VALUES;USDA01244;Milk dessert bar, frozen, made from lowfat milk;Milk dessert bar, frozen, made from lowfat milk;Bar à desserts au lait, gelée, fabriqué avec du lait faible en gras;Milk dessert bar, frozen, made from lowfat milk;USDA;Dairy and Egg Products;Table USDA
VALUES;USDA01250;Nutritional supplement for people with diabetes, liquid;Nutritional supplement for people with diabetes, liquid;Complément nutritionnel pour les personnes atteintes de diabète, de liquide;Nutritional supplement for people with diabetes, liquid;USDA;Dairy and Egg Products;Table USDA
VALUES;USDA01251;Cheese, Mexican blend;Cheese, Mexican blend;Fromage, mélange mexicain;Cheese, Mexican blend;USDA;Dairy and Egg Products;Table USDA
